<?xml version="1.0"?>
<!DOCTYPE Report
[
<!ELEMENT Report (General ,(Doc|BPT)) >
<!ATTLIST Report ver CDATA #REQUIRED tmZone CDATA #REQUIRED>

<!ELEMENT General ( DocLocation ) >
<!ATTLIST General productName CDATA #REQUIRED productVer CDATA #REQUIRED os CDATA #REQUIRED host CDATA #REQUIRED qcserver CDATA #IMPLIED qcproject CDATA #IMPLIED SolManSolutionId CDATA #IMPLIED SolManProjectId CDATA #IMPLIED SolManTestPlanId CDATA #IMPLIED SolManTestPackageId CDATA #IMPLIED SolManUserInfoData CDATA #IMPLIED  >

<!ELEMENT BPT (DName,Res,DVer?,TSet?,TInst?,NodeArgs,AdditionalInfo*,Doc*) >
<!ATTLIST BPT rID ID #REQUIRED >

<!ELEMENT Doc (DName,ConfName?,Res,DVer?,TSet?,TInst?,RunType?,DT?,AdditionalInfo*,Step*,DIter*,Step*,Action*,Doc*,Summary?,TestMaintenanceSummary*,NodeArgs?) >
<!ATTLIST Doc rID ID #REQUIRED type (Test|BC|BPTWrapperTest|Flow|Group|Action) "Test" productName CDATA #REQUIRED BCIter CDATA #IMPLIED >

<!ELEMENT RunType ( #PCDATA )>
<!ATTLIST RunType fmStep (False|True) "False" batch (False|True) "False" upDesc (False|True) "False" upChk (False|True) "False" upAS (False|True) "False">

<!ELEMENT DName ( #PCDATA ) >

<!ELEMENT ConfName ( #PCDATA ) >

<!ELEMENT Res ( #PCDATA ) >

<!ELEMENT AdditionalInfo (AdditionalDataName,AdditionalDataValue ) >

<!ELEMENT AdditionalDataName ( #PCDATA ) >

<!ELEMENT AdditionalDataValue ( #PCDATA ) >

<!ELEMENT DVer ( #PCDATA ) >

<!ELEMENT TSet ( #PCDATA ) >

<!ELEMENT TInst ( #PCDATA ) >

<!ELEMENT DIter (Step*,Action+,Summary?,NodeArgs)>
<!ATTLIST DIter rID ID #REQUIRED iterID CDATA #REQUIRED>

<!ELEMENT DocLocation ( #PCDATA )>

<!ELEMENT Action (AName,AIter*,(Step|HtmlStep|Action)*, Summary,ActionMaintenanceSummary*, NodeArgs ) >
<!ATTLIST Action rID ID #REQUIRED>

<!ELEMENT AIter ((Step|HtmlStep|Action)*,DataMapping?, Summary?,NodeArgs) >
<!ATTLIST AIter rID ID #REQUIRED iterID CDATA #REQUIRED isCountable (False|True) "False" >

<!ELEMENT AName ( #PCDATA ) >

<!ELEMENT TestMaintenanceSummary (ActionMaintenanceSummary*) >
<!ATTLIST TestMaintenanceSummary ObjectsAdded CDATA #REQUIRED ObjectsUpdated CDATA #REQUIRED StepsUpdated CDATA #REQUIRED StepsComments CDATA #REQUIRED><!ELEMENT ActionMaintenanceSummary (ObjectChange* ) >
<!ATTLIST ActionMaintenanceSummary Action CDATA #REQUIRED Objects CDATA #REQUIRED Updated CDATA #REQUIRED LinesTotal CDATA #REQUIRED Added CDATA #REQUIRED LinesUpdated CDATA #REQUIRED>

<!ELEMENT ObjectChange  (Hierarchy, PropertyChangeList* ) >
<!ATTLIST ObjectChange Operation CDATA #IMPLIED OriginalRepository CDATA #IMPLIED>

<!ELEMENT PropertyChangeList (PropertyDef*) >

<!ELEMENT PropertyDef (OriginalValue, NewValue) >
<!ATTLIST PropertyDef PropName CDATA #REQUIRED OriginRegularExpression (True|False) "False" NewRegularExpression (True|False) "False" AddedProperty (True|False) "False" >

<!ELEMENT OriginalValue ( #PCDATA )>

<!ELEMENT NewValue ( #PCDATA )>

<!ELEMENT Hierarchy  (ObjectName, Hierarchy*) >
<!ATTLIST Hierarchy MicClass CDATA #REQUIRED>

<!ELEMENT ObjectName  ( #PCDATA ) >

<!ELEMENT Step (Obj,Details,Time,TimeTick* ,(Step|HtmlStep|Doc)*, DataMapping?, NodeArgs) >
<!ATTLIST Step rID ID #REQUIRED retval CDATA #IMPLIED>

<!ELEMENT HtmlStep (HTML,TimeTick*,(Step|HtmlStep|Doc)*,NodeArgs) >
<!ATTLIST HtmlStep rID ID #REQUIRED >

<!ELEMENT Obj ( #PCDATA ) >
<!ATTLIST Obj plainTxt (False|True) "True">

<!ELEMENT Details ( #PCDATA ) >
<!ATTLIST Details plainTxt (False|True) "True">

<!ELEMENT Time ( #PCDATA ) >

<!ELEMENT HTML ( #PCDATA ) >

<!ELEMENT Disp ( #PCDATA ) >

<!ELEMENT TimeTick ( #PCDATA ) >

<!ELEMENT DataMapping ( DataMappedItem* )>
<!ELEMENT DataMappedItem EMPTY >
<!ATTLIST DataMappedItem dsName CDATA #REQUIRED >
<!ATTLIST DataMappedItem rowId CDATA #REQUIRED >

<!ELEMENT NodeArgs (Disp,TopPane?,BtmPane?,ExtendedInfo? )>
<!ATTLIST NodeArgs eType CDATA #REQUIRED icon CDATA #REQUIRED nRep CDATA #REQUIRED UserNote CDATA #IMPLIED filter (False|True) "True">
<!ATTLIST NodeArgs status (Passed|Failed|Done|Warning|Information) "Done">
<!ATTLIST NodeArgs iconSel CDATA #IMPLIED nType CDATA #IMPLIED MovieMarker CDATA "">
<!ATTLIST NodeArgs Source CDATA #IMPLIED SourceLine CDATA #IMPLIED StepFlowItemKey CDATA #IMPLIED >

<!ELEMENT TopPane (Path)>

<!ELEMENT BtmPane ( (Path|WR)?,ASHilite?)>
<!ATTLIST BtmPane vType CDATA "HTML">

<!ELEMENT Path ( #PCDATA ) >

<!ELEMENT ASHilite ( #PCDATA ) >

<!ELEMENT WR ( #PCDATA ) >

<!ELEMENT ExtendedInfo ( StepData ) >

<!ATTLIST ExtendedInfo StepType CDATA #REQUIRED>
<!ELEMENT DT (NodeArgs) >
<!ATTLIST DT rID ID #REQUIRED>

<!ELEMENT Summary (Param*)>
<!ATTLIST Summary sTime CDATA #IMPLIED eTime CDATA #IMPLIED passed CDATA #IMPLIED failed CDATA #IMPLIED warnings CDATA #IMPLIED retval CDATA #IMPLIED stopped (False|True) "False" >

<!ELEMENT Param (ParamName,ParamVal)+ >
<!ATTLIST Param paramInOut (In|Out) "In">

<!ELEMENT ParamName ( #PCDATA ) >

<!ELEMENT ParamVal ( #PCDATA ) >

]
>
<Report ver="2.0" tmZone="India Standard Time">
<General productName="HP Unified Functional Testing" productVer="11.50" os="Windows 7" host="LT0021567"><DocLocation><![CDATA[C:\RIL_TTAF\Scripts\AutomationDriverScript_Fulfilment]]></DocLocation></General>
<Doc rID="T1"   productName= "HP Unified Functional Testing"  >
<DName><![CDATA[AutomationDriverScript_Fulfilment]]></DName>
<Res><![CDATA[AdapterRunRes]]></Res>
<DT rID="T2">
<NodeArgs eType="Table" icon="2" nRep="4" filter="False" >
<Disp><![CDATA[Run-Time Data Table]]></Disp>
<BtmPane vType="Table" >
<Path><![CDATA[Default.xls]]></Path>
</BtmPane>
</NodeArgs>
</DT>
<DIter rID="T3" iterID="1" >
<Action rID="T4">
<AName><![CDATA[Action1]]></AName>
<Step rID="T5">
<Obj ><![CDATA[Pass]]></Obj>
<Details ><![CDATA[Total Execution row (iDriver_RowCount) : 1262]]></Details>
<Time><![CDATA[03-08-2015 - 17:00:44]]></Time>
<TimeTick>1438601444</TimeTick>
<NodeArgs eType="User" icon="5" nRep="8" status="Passed" >
<Disp><![CDATA[Pass]]></Disp>
</NodeArgs>
</Step>
<Step rID="T6">
<Obj ><![CDATA[Pass]]></Obj>
<Details ><![CDATA[Business component call Fn_CreateTestCase execution initiated]]></Details>
<Time><![CDATA[03-08-2015 - 17:00:48]]></Time>
<TimeTick>1438601448</TimeTick>
<NodeArgs eType="User" icon="5" nRep="9" status="Passed" >
<Disp><![CDATA[Pass]]></Disp>
</NodeArgs>
</Step>
<Step rID="T7">
<Obj ><![CDATA[Pass]]></Obj>
<Details ><![CDATA[=====================================================================================================================]]></Details>
<Time><![CDATA[03-08-2015 - 17:00:48]]></Time>
<TimeTick>1438601448</TimeTick>
<NodeArgs eType="User" icon="5" nRep="10" status="Passed" >
<Disp><![CDATA[Pass]]></Disp>
</NodeArgs>
</Step>
<Step rID="T8">
<Obj ><![CDATA[Pass]]></Obj>
<Details ><![CDATA[Date:03-08-2015   Time:17:00:48]]></Details>
<Time><![CDATA[03-08-2015 - 17:00:48]]></Time>
<TimeTick>1438601448</TimeTick>
<NodeArgs eType="User" icon="5" nRep="11" status="Passed" >
<Disp><![CDATA[Pass]]></Disp>
</NodeArgs>
</Step>
<Step rID="T9">
<Obj ><![CDATA[Pass]]></Obj>
<Details ><![CDATA[Testcase ID:SBL-203B_E2E_OrderEntry_TC30_Verify that CAF entry and order validation for individual customer for the product postpaid Volte using Paper CAF(HTWEBAPP)]]></Details>
<Time><![CDATA[03-08-2015 - 17:00:48]]></Time>
<TimeTick>1438601448</TimeTick>
<NodeArgs eType="User" icon="5" nRep="12" status="Passed" >
<Disp><![CDATA[Pass]]></Disp>
</NodeArgs>
</Step>
<Step rID="T10">
<Obj ><![CDATA[Pass]]></Obj>
<Details ><![CDATA[Testcase Description:PostPaid Volte Individual - OC508]]></Details>
<Time><![CDATA[03-08-2015 - 17:00:48]]></Time>
<TimeTick>1438601448</TimeTick>
<NodeArgs eType="User" icon="5" nRep="13" status="Passed" >
<Disp><![CDATA[Pass]]></Disp>
</NodeArgs>
</Step>
<Step rID="T11">
<Obj ><![CDATA[Pass]]></Obj>
<Details ><![CDATA[Offer Type:PostPaid Volte]]></Details>
<Time><![CDATA[03-08-2015 - 17:00:48]]></Time>
<TimeTick>1438601448</TimeTick>
<NodeArgs eType="User" icon="5" nRep="14" status="Passed" >
<Disp><![CDATA[Pass]]></Disp>
</NodeArgs>
</Step>
<Step rID="T12">
<Obj ><![CDATA[Pass]]></Obj>
<Details ><![CDATA[=====================================================================================================================]]></Details>
<Time><![CDATA[03-08-2015 - 17:00:48]]></Time>
<TimeTick>1438601448</TimeTick>
<NodeArgs eType="User" icon="5" nRep="15" status="Passed" >
<Disp><![CDATA[Pass]]></Disp>
</NodeArgs>
</Step>
<Step rID="T13">
<Obj ><![CDATA[Pass]]></Obj>
<Details ><![CDATA[Business component call Fn_CreateTestCase execution completed. Total Time taken = 0 seconds]]></Details>
<Time><![CDATA[03-08-2015 - 17:00:48]]></Time>
<TimeTick>1438601448</TimeTick>
<NodeArgs eType="User" icon="5" nRep="16" status="Passed" >
<Disp><![CDATA[Pass]]></Disp>
</NodeArgs>
</Step>
<Step rID="T14">
<Obj ><![CDATA[Pass]]></Obj>
<Details ><![CDATA[Business component call Fn_PaperCaf_Login execution initiated]]></Details>
<Time><![CDATA[03-08-2015 - 17:00:51]]></Time>
<TimeTick>1438601451</TimeTick>
<NodeArgs eType="User" icon="5" nRep="17" status="Passed" >
<Disp><![CDATA[Pass]]></Disp>
</NodeArgs>
</Step>
<Step rID="T15">
<Obj plainTxt="False" ><![CDATA[[ Link ].Exist]]></Obj>
<Details plainTxt="False" ><![CDATA["Object does not exist"]]></Details>
<Time><![CDATA[03-08-2015 - 17:00:57]]></Time>
<TimeTick>1438601457</TimeTick>
<NodeArgs eType="Replay" icon="6" nRep="43" >
<Disp><![CDATA[[ Link ].Exist]]></Disp>
</NodeArgs>
</Step>
<Step rID="T16">
<Obj ><![CDATA[Pass]]></Obj>
<Details ><![CDATA[-------------------------------Paper CAF : Login Started----------------------------------------]]></Details>
<Time><![CDATA[03-08-2015 - 17:00:58]]></Time>
<TimeTick>1438601458</TimeTick>
<NodeArgs eType="User" icon="5" nRep="44" status="Passed" >
<Disp><![CDATA[Pass]]></Disp>
</NodeArgs>
</Step>
<Step rID="T17">
<Obj plainTxt="False" ><![CDATA[[ WinButton ].Exist]]></Obj>
<Details plainTxt="False" ><![CDATA["Object does not exist"]]></Details>
<Time><![CDATA[03-08-2015 - 17:01:04]]></Time>
<TimeTick>1438601464</TimeTick>
<NodeArgs eType="Replay" icon="7" nRep="51" >
<Disp><![CDATA[[ WinButton ].Exist]]></Disp>
</NodeArgs>
</Step>
<Step rID="T18">
<Obj plainTxt="False" ><![CDATA[[ jio - Ab Dikha Do Apna Magic ].Exist]]></Obj>
<Details plainTxt="False" ><![CDATA["Object exists"]]></Details>
<Time><![CDATA[03-08-2015 - 17:01:04]]></Time>
<TimeTick>1438601464</TimeTick>
<NodeArgs eType="Replay" icon="8" nRep="53" >
<Disp><![CDATA[[ jio - Ab Dikha Do Apna Magic ].Exist]]></Disp>
</NodeArgs>
</Step>
<Step rID="T19">
<Obj plainTxt="False" ><![CDATA[[ username ].Exist]]></Obj>
<Details plainTxt="False" ><![CDATA["Object exists"]]></Details>
<Time><![CDATA[03-08-2015 - 17:01:04]]></Time>
<TimeTick>1438601464</TimeTick>
<NodeArgs eType="Replay" icon="9" nRep="55" >
<Disp><![CDATA[[ username ].Exist]]></Disp>
</NodeArgs>
</Step>
<Step rID="T20">
<Obj plainTxt="False" ><![CDATA[[ username ].Set]]></Obj>
<Details plainTxt="False" ><![CDATA["DVAP1_JC09"]]></Details>
<Time><![CDATA[03-08-2015 - 17:01:05]]></Time>
<TimeTick>1438601465</TimeTick>
<NodeArgs eType="Replay" icon="9" nRep="57" >
<Disp><![CDATA[[ username ].Set]]></Disp>
</NodeArgs>
</Step>
<Step rID="T21">
<Obj ><![CDATA[Pass]]></Obj>
<Details ><![CDATA[Username set to : DVAP1_JC09]]></Details>
<Time><![CDATA[03-08-2015 - 17:01:05]]></Time>
<TimeTick>1438601465</TimeTick>
<NodeArgs eType="User" icon="5" nRep="58" status="Passed" >
<Disp><![CDATA[Pass]]></Disp>
</NodeArgs>
</Step>
<Step rID="T22">
<Obj plainTxt="False" ><![CDATA[[ password ].Exist]]></Obj>
<Details plainTxt="False" ><![CDATA["Object exists"]]></Details>
<Time><![CDATA[03-08-2015 - 17:01:05]]></Time>
<TimeTick>1438601465</TimeTick>
<NodeArgs eType="Replay" icon="9" nRep="59" >
<Disp><![CDATA[[ password ].Exist]]></Disp>
</NodeArgs>
</Step>
<Step rID="T23">
<Obj plainTxt="False" ><![CDATA[[ password ].Set]]></Obj>
<Details plainTxt="False" ><![CDATA["YgelIpd6u"]]></Details>
<Time><![CDATA[03-08-2015 - 17:01:05]]></Time>
<TimeTick>1438601465</TimeTick>
<NodeArgs eType="Replay" icon="9" nRep="61" >
<Disp><![CDATA[[ password ].Set]]></Disp>
</NodeArgs>
</Step>
<Step rID="T24">
<Obj ><![CDATA[Pass]]></Obj>
<Details ><![CDATA[Password set to : YgelIpd6u]]></Details>
<Time><![CDATA[03-08-2015 - 17:01:05]]></Time>
<TimeTick>1438601465</TimeTick>
<NodeArgs eType="User" icon="5" nRep="62" status="Passed" >
<Disp><![CDATA[Pass]]></Disp>
</NodeArgs>
</Step>
<Step rID="T25">
<Obj plainTxt="False" ><![CDATA[[ Login ].Exist]]></Obj>
<Details plainTxt="False" ><![CDATA["Object exists"]]></Details>
<Time><![CDATA[03-08-2015 - 17:01:06]]></Time>
<TimeTick>1438601466</TimeTick>
<NodeArgs eType="Replay" icon="10" nRep="63" >
<Disp><![CDATA[[ Login ].Exist]]></Disp>
</NodeArgs>
</Step>
<Step rID="T26">
<Obj plainTxt="False" ><![CDATA[[ Login ].Click]]></Obj>
<Details plainTxt="False" ><![CDATA[]]></Details>
<Time><![CDATA[03-08-2015 - 17:01:06]]></Time>
<TimeTick>1438601466</TimeTick>
<NodeArgs eType="Replay" icon="10" nRep="65" >
<Disp><![CDATA[[ Login ].Click]]></Disp>
</NodeArgs>
</Step>
<Step rID="T27">
<Obj plainTxt="False" ><![CDATA[[ New CAF ].Exist]]></Obj>
<Details plainTxt="False" ><![CDATA["Object exists"]]></Details>
<Time><![CDATA[03-08-2015 - 17:01:08]]></Time>
<TimeTick>1438601468</TimeTick>
<NodeArgs eType="Replay" icon="6" nRep="67" >
<Disp><![CDATA[[ New CAF ].Exist]]></Disp>
</NodeArgs>
</Step>
<Step rID="T28">
<Obj ><![CDATA[Pass]]></Obj>
<Details ><![CDATA[Successfully Logged into Paper Caf]]></Details>
<Time><![CDATA[03-08-2015 - 17:01:08]]></Time>
<TimeTick>1438601468</TimeTick>
<NodeArgs eType="User" icon="5" nRep="68" status="Passed" >
<Disp><![CDATA[Pass]]></Disp>
</NodeArgs>
</Step>
<Step rID="T29">
<Obj ><![CDATA[Pass]]></Obj>
<Details ><![CDATA[Business component call Fn_PaperCaf_Login execution completed. Total Time taken = 17 seconds]]></Details>
<Time><![CDATA[03-08-2015 - 17:01:08]]></Time>
<TimeTick>1438601468</TimeTick>
<NodeArgs eType="User" icon="5" nRep="69" status="Passed" >
<Disp><![CDATA[Pass]]></Disp>
</NodeArgs>
</Step>
<Step rID="T30">
<Obj ><![CDATA[Pass]]></Obj>
<Details ><![CDATA[Saving ExcelDashBoardReport]]></Details>
<Time><![CDATA[03-08-2015 - 17:01:11]]></Time>
<TimeTick>1438601471</TimeTick>
<NodeArgs eType="User" icon="5" nRep="70" status="Passed" >
<Disp><![CDATA[Pass]]></Disp>
</NodeArgs>
</Step>
<Step rID="T31">
<Obj ><![CDATA[Pass]]></Obj>
<Details ><![CDATA[ExcelDashBoardReport Saved]]></Details>
<Time><![CDATA[03-08-2015 - 17:01:12]]></Time>
<TimeTick>1438601472</TimeTick>
<NodeArgs eType="User" icon="5" nRep="71" status="Passed" >
<Disp><![CDATA[Pass]]></Disp>
</NodeArgs>
</Step>
<Summary sTime="03-08-2015 - 17:00:32" eTime="03-08-2015 - 17:01:12" passed="17" failed="0" warnings="0" ></Summary>
<NodeArgs eType="StartAction" icon="4" nRep="7" status="Passed" >
<Disp><![CDATA[Action1 Summary]]></Disp>
</NodeArgs>
</Action>
<NodeArgs eType="StartIteration" icon="3" nRep="6" status="Passed" >
<Disp><![CDATA[AutomationDriverScript_Fulfilment Iteration 1 (Row 1)]]></Disp>
</NodeArgs>
</DIter>
<DIter rID="T32" iterID="2" >
<Action rID="T33">
<AName><![CDATA[Action1]]></AName>
<Step rID="T34">
<Obj ><![CDATA[Pass]]></Obj>
<Details ><![CDATA[Empty testCaseID found. Possibly End of Execution.]]></Details>
<Time><![CDATA[03-08-2015 - 17:01:12]]></Time>
<TimeTick>1438601472</TimeTick>
<NodeArgs eType="User" icon="5" nRep="76" status="Passed" >
<Disp><![CDATA[Pass]]></Disp>
</NodeArgs>
</Step>
<Step rID="T35">
<Obj ><![CDATA[Pass]]></Obj>
<Details ><![CDATA[Execution wrapUp initiated]]></Details>
<Time><![CDATA[03-08-2015 - 17:01:12]]></Time>
<TimeTick>1438601472</TimeTick>
<NodeArgs eType="User" icon="5" nRep="77" status="Passed" >
<Disp><![CDATA[Pass]]></Disp>
</NodeArgs>
</Step>
<Step rID="T36">
<Obj ><![CDATA[Pass]]></Obj>
<Details ><![CDATA[Saving ExcelDashBoardReport]]></Details>
<Time><![CDATA[03-08-2015 - 17:01:12]]></Time>
<TimeTick>1438601472</TimeTick>
<NodeArgs eType="User" icon="5" nRep="78" status="Passed" >
<Disp><![CDATA[Pass]]></Disp>
</NodeArgs>
</Step>
<Step rID="T37">
<Obj ><![CDATA[Pass]]></Obj>
<Details ><![CDATA[ExcelDashBoardReport Saved]]></Details>
<Time><![CDATA[03-08-2015 - 17:01:12]]></Time>
<TimeTick>1438601472</TimeTick>
<NodeArgs eType="User" icon="5" nRep="79" status="Passed" >
<Disp><![CDATA[Pass]]></Disp>
</NodeArgs>
</Step>
<Step rID="T38">
<Obj ><![CDATA[Pass]]></Obj>
<Details ><![CDATA[Closing HTML report]]></Details>
<Time><![CDATA[03-08-2015 - 17:01:12]]></Time>
<TimeTick>1438601472</TimeTick>
<NodeArgs eType="User" icon="5" nRep="80" status="Passed" >
<Disp><![CDATA[Pass]]></Disp>
</NodeArgs>
</Step>
<Step rID="T39">
<Obj ><![CDATA[Pass]]></Obj>
<Details ><![CDATA[HTML report closed]]></Details>
<Time><![CDATA[03-08-2015 - 17:01:12]]></Time>
<TimeTick>1438601472</TimeTick>
<NodeArgs eType="User" icon="5" nRep="81" status="Passed" >
<Disp><![CDATA[Pass]]></Disp>
</NodeArgs>
</Step>
<Step rID="T40">
<Obj ><![CDATA[Pass]]></Obj>
<Details ><![CDATA[Calling CloseExcelDashboardReport]]></Details>
<Time><![CDATA[03-08-2015 - 17:01:12]]></Time>
<TimeTick>1438601472</TimeTick>
<NodeArgs eType="User" icon="5" nRep="82" status="Passed" >
<Disp><![CDATA[Pass]]></Disp>
</NodeArgs>
</Step>
<Step rID="T41">
<Obj ><![CDATA[Pass]]></Obj>
<Details ><![CDATA[CloseExcelDashboardReport Completed]]></Details>
<Time><![CDATA[03-08-2015 - 17:01:12]]></Time>
<TimeTick>1438601472</TimeTick>
<NodeArgs eType="User" icon="5" nRep="83" status="Passed" >
<Disp><![CDATA[Pass]]></Disp>
</NodeArgs>
</Step>
<Step rID="T42">
<Obj ><![CDATA[Pass]]></Obj>
<Details ><![CDATA[Fn_Sendmailreport_fromQTP initiated]]></Details>
<Time><![CDATA[03-08-2015 - 17:01:12]]></Time>
<TimeTick>1438601472</TimeTick>
<NodeArgs eType="User" icon="5" nRep="84" status="Passed" >
<Disp><![CDATA[Pass]]></Disp>
</NodeArgs>
</Step>
<Step rID="T43">
<Obj ><![CDATA[Pass]]></Obj>
<Details ><![CDATA[Fn_Sendmailreport_fromQTP Completed]]></Details>
<Time><![CDATA[03-08-2015 - 17:01:15]]></Time>
<TimeTick>1438601475</TimeTick>
<NodeArgs eType="User" icon="5" nRep="85" status="Passed" >
<Disp><![CDATA[Pass]]></Disp>
</NodeArgs>
</Step>
<Step rID="T44">
<Obj ><![CDATA[Pass]]></Obj>
<Details ><![CDATA[Execution wrapUp Completed]]></Details>
<Time><![CDATA[03-08-2015 - 17:01:15]]></Time>
<TimeTick>1438601475</TimeTick>
<NodeArgs eType="User" icon="5" nRep="86" status="Passed" >
<Disp><![CDATA[Pass]]></Disp>
</NodeArgs>
</Step>
<Step rID="T45">
<Obj plainTxt="False" ><![CDATA[Stop Run]]></Obj>
<Details plainTxt="False" ><![CDATA[Run stopped by user.]]></Details>
<Time><![CDATA[03-08-2015 - 17:01:15]]></Time>
<TimeTick>1438601475</TimeTick>
<NodeArgs eType="General" icon="11" nRep="87" >
<Disp><![CDATA[Stop Run]]></Disp>
</NodeArgs>
</Step>
<Summary sTime="03-08-2015 - 17:01:12" eTime="03-08-2015 - 17:01:15" passed="11" failed="0" warnings="0" ></Summary>
<NodeArgs eType="StartAction" icon="4" nRep="75" status="Passed" >
<Disp><![CDATA[Action1 Summary]]></Disp>
</NodeArgs>
</Action>
<NodeArgs eType="StartIteration" icon="3" nRep="74" status="Passed" >
<Disp><![CDATA[AutomationDriverScript_Fulfilment Iteration 2 (Row 2)]]></Disp>
</NodeArgs>
</DIter>
<Summary sTime="03-08-2015 - 17:00:27" eTime="03-08-2015 - 17:01:15" passed="28" failed="0" warnings="0" ></Summary>
<NodeArgs eType="StartTest" icon="1" nRep="3" status="Passed" >
<Disp><![CDATA[Test AutomationDriverScript_Fulfilment Summary]]></Disp>
</NodeArgs>
</Doc>
</Report>